{
  "profile_version": "1.0",
  "evidence_kind": "estimated",
  "rate_profile_id": "replace-with-rate-profile-identity",
  "environment_id": null,
  "usage": {
    "uncached_input_tokens": 0,
    "cache_write_tokens": 0,
    "cache_read_tokens": 0,
    "output_tokens": 0,
    "latency_ms": null
  },
  "rates": {
    "currency": "USD",
    "per_million": {
      "uncached_input": 0.0,
      "cache_write": 0.0,
      "cache_read": 0.0,
      "output": 0.0
    }
  }
}
